{
  "schemaVersion": 1,
  "artifactType": "report",
  "generatedAt": "2026-08-09T10:00:00Z",
  "reportId": "report-20260809-001",
  "property": "properties/200",
  "timezone": "Asia/Bangkok",
  "currency": "USD",
  "periods": [{"label": "current", "from": "2026-08-01", "to": "2026-08-08", "complete": true}],
  "queries": [{"provider": "analytics-data", "method": "runReport", "apiChannel": "v1beta", "requestId": "request-1", "filters": {"eventName": "purchase"}, "returnPropertyQuota": true, "responseMetadata": {"sampled": false, "thresholded": "unknown", "dataLossFromOtherRow": false, "quota": {"tokensConsumed": 10}}}],
  "facts": [{"statement": "100 active users", "source": "Data API runReport"}],
  "calculations": [{"name": "change", "formula": "(current-previous)/previous", "result": "0.10"}],
  "interpretations": ["Traffic increased, but this does not establish a cause."],
  "limitations": [{"type": "small-data", "message": "Only eight complete days are available."}],
  "recommendations": [{"priority": 1, "action": "Verify purchase coverage", "evidence": "Purchase count is lower than backend orders", "benefit": "More reliable revenue reporting", "effort": "medium", "risk": "low", "verification": "Compare unique transaction IDs"}],
  "questions": ["Which backend status confirms payment?"]
}
